<?xml version="1.0" encoding="utf-8"?>
<!--XML file automatically generated by WorkVisual V6.0.31_Build3247.-->
<!--DO NOT EDIT-->
<ServoFile xsi:noNamespaceSchemaLocation="../../../System/Common/Schemes/Servofile.xsd" xmlns:xsi="http://www.w3.org/2001/XMLSchema-instance">
  <!--#############################################################-->
  <!--########                                             ########-->
  <!--########                  SERVO-FILE                 ########-->
  <!--########             KUKA DEUTSCHLAND GMBH           ########-->
  <!--########                                             ########-->
  <!--#############################################################-->
  <!--ATB 3.0.7, DB V8.521, ID 1000003, V8.7.4-->
  <!--Datum: 17-Mar-2022 06:45:07-->
  <!--Control: KPP600-67L-->
  <Parameter Index="0x5031" Relative="false" SubIndex="1" Type="INT32" Value="0x50470003" />
  <Parameter Index="0x5031" Relative="false" SubIndex="2" Type="INT32" Value="0x50470003" />
  <Parameter Index="0x5031" Relative="false" SubIndex="3" Type="INT32" Value="0x50470003" />
  <Parameter Index="0x5031" Relative="false" SubIndex="4" Type="INT32" Value="0x50470003" />
  <Parameter Index="0x5031" Relative="false" SubIndex="5" Type="INT32" Value="0x50470003" />
  <Parameter Index="0x5031" Relative="false" SubIndex="6" Type="INT32" Value="0x50470003" />
  <Parameter Index="0x5031" Relative="false" SubIndex="7" Type="INT32" Value="0x50470003" />
  <Parameter Index="0x5031" Relative="false" SubIndex="8" Type="INT32" Value="0x50470003" />
  <Parameter Index="0x5031" Relative="false" SubIndex="9" Type="INT32" Value="0x50470003" />
  <Parameter Index="0x5031" Relative="false" SubIndex="10" Type="INT32" Value="0x50470003" />
  <Parameter Index="0x5031" Relative="false" SubIndex="11" Type="INT32" Value="0x50470003" />
  <Parameter Index="0x5031" Relative="false" SubIndex="12" Type="INT32" Value="0x50470003" />
  <Parameter Index="0x5031" Relative="false" SubIndex="13" Type="INT32" Value="0x50470003" />
  <Parameter Index="0x5031" Relative="false" SubIndex="14" Type="INT32" Value="0x50470003" />
  <Parameter Index="0x5031" Relative="false" SubIndex="15" Type="INT32" Value="0x50470003" />
  <Parameter Index="0x5031" Relative="false" SubIndex="16" Type="INT32" Value="0x50470003" />
  <Parameter Index="0x5040" Relative="false" SubIndex="4" Type="UINT16" Value="3200" />
  <Parameter Index="0x5040" Relative="false" SubIndex="5" Type="UINT16" Value="11" />
  <Parameter Index="0x5043" Relative="false" SubIndex="2" Type="FLOAT32" Value="775" />
  <Parameter Index="0x5043" Relative="false" SubIndex="3" Type="FLOAT32" Value="755" />
</ServoFile>